{
  "schema_version": "1.0",
  "decision_id": "55555555-5555-4555-8555-555555555555",
  "raw_message_id": "66666666-6666-4666-8666-666666666666",
  "processing_run_id": "77777777-7777-4777-8777-777777777777",
  "context_snapshot_id": "88888888-8888-4888-8888-888888888888",
  "classification": {
    "message_type": "ambiguous",
    "action": "needs_review",
    "ambiguous": true,
    "ambiguity_reasons": [
      "entry-zone-missing-side",
      "multiple-symbols"
    ]
  },
  "intent": {
    "account_scope": "unassigned",
    "target_account_id": null,
    "target_position_id": null,
    "instrument_symbol": null,
    "side": null,
    "entry": {
      "type": "zone",
      "price": null,
      "price_min": 65000,
      "price_max": 65500
    },
    "stop_loss": null,
    "take_profits": [],
    "leverage": null,
    "valid_until": null
  },
  "evidence": [],
  "model": {
    "provider": "hermes",
    "model_version": "hermes-2026-06-19",
    "prompt_version": "prompt-v7",
    "temperature": 0.2
  },
  "created_at": "2026-06-19T12:02:00Z"
}

