{
  "schema_version": "1.0",
  "decision_id": "11111111-1111-4111-8111-111111111111",
  "raw_message_id": "22222222-2222-4222-8222-222222222222",
  "processing_run_id": "33333333-3333-4333-8333-333333333333",
  "context_snapshot_id": "44444444-4444-4444-8444-444444444444",
  "classification": {
    "message_type": "new_signal",
    "action": "open_position",
    "ambiguous": false,
    "ambiguity_reasons": []
  },
  "intent": {
    "account_scope": "single",
    "target_account_id": "acct-main",
    "target_position_id": null,
    "instrument_symbol": "BTCUSDT.PERP",
    "side": "long",
    "entry": {
      "type": "limit",
      "price": 65000.5,
      "price_min": null,
      "price_max": null
    },
    "stop_loss": 64000,
    "take_profits": [
      66000,
      67250
    ],
    "leverage": 3,
    "valid_until": "2026-06-19T13:00:00Z"
  },
  "evidence": [
    "source-message-line-1"
  ],
  "model": {
    "provider": "hermes",
    "model_version": "hermes-2026-06-19",
    "prompt_version": "prompt-v7",
    "temperature": 0.1
  },
  "created_at": "2026-06-19T12:00:00Z",
  "confidence": 0.84
}

